{
  "publisher": "人民教育出版社",
  "series": "义务教育教科书",
  "grade": 5,
  "volume": "上册",
  "editionText": "统编版",
  "subject": "chinese",
  "units": [
    {
      "order": 1,
      "title": "第一单元",
      "sections": [
        {
          "key": "lesson-1",
          "order": 1,
          "title": "第1课",
          "type": "lesson",
          "cards": [
            {
              "answerText": "桂花",
              "broadcastText": "桂花",
              "pinyinText": "guì huā",
              "hintText": "秋天，院里的（　　）开了，满园都是甜甜的香气。",
              "curriculumSource": "required_vocabulary",
              "builtinKey": "cn-g5-v1-u1-lesson-1-001"
            },
            {
              "answerText": "故乡",
              "broadcastText": "故乡",
              "pinyinText": "gù xiāng",
              "hintText": "离家多年，爷爷仍然思念自己出生的（　　）。",
              "curriculumSource": "required_vocabulary",
              "builtinKey": "cn-g5-v1-u1-lesson-1-002"
            },
            {
              "answerText": "欣赏",
              "broadcastText": "欣赏",
              "pinyinText": "xīn shǎng",
              "hintText": "美术课上，我们一起（　　）同学们画的春景图。",
              "curriculumSource": "required_vocabulary",
              "builtinKey": "cn-g5-v1-u1-lesson-1-003"
            },
            {
              "answerText": "木兰花",
              "broadcastText": "木兰花",
              "pinyinText": "mù lán huā",
              "hintText": "窗前的（　　）开了，洁白的花瓣像小小的杯子。",
              "curriculumSource": "required_vocabulary",
              "builtinKey": "cn-g5-v1-u1-lesson-1-004"
            },
            {
              "answerText": "台风",
              "broadcastText": "台风",
              "pinyinText": "tái fēng",
              "hintText": "（　　）来临前，海边的渔船纷纷回到港口避风。",
              "curriculumSource": "required_vocabulary",
              "builtinKey": "cn-g5-v1-u1-lesson-1-005"
            },
            {
              "answerText": "老婆婆",
              "broadcastText": "老婆婆",
              "pinyinText": "lǎo pó po",
              "hintText": "过马路时，他主动扶着一位白发苍苍的（　　）。",
              "curriculumSource": "required_vocabulary",
              "builtinKey": "cn-g5-v1-u1-lesson-1-006"
            },
            {
              "answerText": "糕饼",
              "broadcastText": "糕饼",
              "pinyinText": "gāo bǐng",
              "hintText": "奶奶把做好的（　　）装进盒子，分给邻居品尝。",
              "curriculumSource": "required_vocabulary",
              "builtinKey": "cn-g5-v1-u1-lesson-1-007"
            },
            {
              "answerText": "尤其",
              "broadcastText": "尤其",
              "pinyinText": "yóu qí",
              "hintText": "我喜欢各种球类运动，（　　）喜欢打乒乓球。",
              "curriculumSource": "required_vocabulary",
              "builtinKey": "cn-g5-v1-u1-lesson-1-008"
            },
            {
              "answerText": "使劲",
              "broadcastText": "使劲",
              "pinyinText": "shǐ jìn",
              "hintText": "这扇门太紧了，他（　　）推了几下才推开。",
              "curriculumSource": "required_vocabulary",
              "builtinKey": "cn-g5-v1-u1-lesson-1-009"
            },
            {
              "answerText": "茶叶",
              "broadcastText": "茶叶",
              "pinyinText": "chá yè",
              "hintText": "热水倒进杯里，卷起的（　　）慢慢舒展开来。",
              "curriculumSource": "required_vocabulary",
              "builtinKey": "cn-g5-v1-u1-lesson-1-010"
            },
            {
              "answerText": "笨拙",
              "broadcastText": "笨拙",
              "pinyinText": "bèn zhuō",
              "hintText": "小熊第一次学跳舞，动作有些（　　），常常跟不上节拍。",
              "curriculumSource": "writing_practice",
              "builtinKey": "cn-g5-v1-u1-lesson-1-011",
              "adaptation": "replaced",
              "originalAnswerText": "笨重"
            },
            {
              "answerText": "沉浸",
              "broadcastText": "沉浸",
              "pinyinText": "chén jìn",
              "hintText": "他（　　）在有趣的故事中，连下课铃响了都没听见。",
              "curriculumSource": "writing_practice",
              "builtinKey": "cn-g5-v1-u1-lesson-1-012",
              "adaptation": "retained"
            }
          ]
        },
        {
          "key": "lesson-2",
          "order": 2,
          "title": "第2课",
          "type": "lesson",
          "cards": [
            {
              "answerText": "浇水",
              "broadcastText": "浇水",
              "pinyinText": "jiāo shuǐ",
              "hintText": "花盆里的土干了，该给小花（　　）了。",
              "curriculumSource": "required_vocabulary",
              "builtinKey": "cn-g5-v1-u1-lesson-2-001"
            },
            {
              "answerText": "食品",
              "broadcastText": "食品",
              "pinyinText": "shí pǐn",
              "hintText": "购买（　　）时，要留意包装上的生产日期。",
              "curriculumSource": "required_vocabulary",
              "builtinKey": "cn-g5-v1-u1-lesson-2-002"
            },
            {
              "answerText": "吩咐",
              "broadcastText": "吩咐",
              "pinyinText": "fēn fù",
              "hintText": "出门前，妈妈（　　）我把窗户关好。",
              "curriculumSource": "required_vocabulary",
              "builtinKey": "cn-g5-v1-u1-lesson-2-003"
            },
            {
              "answerText": "茅亭",
              "broadcastText": "茅亭",
              "pinyinText": "máo tíng",
              "hintText": "山脚有座用茅草盖顶的（　　），游人可以在那里歇脚。",
              "curriculumSource": "required_vocabulary",
              "builtinKey": "cn-g5-v1-u1-lesson-2-004"
            },
            {
              "answerText": "可贵",
              "broadcastText": "可贵",
              "pinyinText": "kě guì",
              "hintText": "这份帮助来得及时，让我感到朋友的关心十分（　　）。",
              "curriculumSource": "required_vocabulary",
              "builtinKey": "cn-g5-v1-u1-lesson-2-005"
            },
            {
              "answerText": "嫩绿",
              "broadcastText": "嫩绿",
              "pinyinText": "nèn lǜ",
              "hintText": "春风吹过，柳枝上长出了（　　）的新叶。",
              "curriculumSource": "required_vocabulary",
              "builtinKey": "cn-g5-v1-u1-lesson-2-006"
            },
            {
              "answerText": "体面",
              "broadcastText": "体面",
              "pinyinText": "tǐ miàn",
              "hintText": "爷爷常说，肯踏实劳动，就算工作普通也很（　　）。",
              "curriculumSource": "required_vocabulary",
              "builtinKey": "cn-g5-v1-u1-lesson-2-007"
            },
            {
              "answerText": "一亩地",
              "broadcastText": "一亩地",
              "pinyinText": "yì mǔ dì",
              "hintText": "爷爷在村边的（　　）上种了蔬菜，面积比半亩大一倍。",
              "curriculumSource": "writing_practice",
              "builtinKey": "cn-g5-v1-u1-lesson-2-008",
              "adaptation": "replaced",
              "originalAnswerText": "半亩地"
            },
            {
              "answerText": "荒地",
              "broadcastText": "荒地",
              "pinyinText": "huāng dì",
              "hintText": "村民把杂草丛生的（　　）开垦成了菜园。",
              "curriculumSource": "writing_practice",
              "builtinKey": "cn-g5-v1-u1-lesson-2-009",
              "adaptation": "replaced",
              "originalAnswerText": "荒凉"
            },
            {
              "answerText": "矮小",
              "broadcastText": "矮小",
              "pinyinText": "ǎi xiǎo",
              "hintText": "这棵果树虽然（　　），枝头却结满了果子。",
              "curriculumSource": "writing_practice",
              "builtinKey": "cn-g5-v1-u1-lesson-2-010",
              "adaptation": "retained"
            }
          ]
        }
      ]
    },
    {
      "order": 2,
      "title": "第二单元",
      "sections": [
        {
          "key": "lesson-4",
          "order": 1,
          "title": "第4课",
          "type": "lesson",
          "cards": [
            {
              "answerText": "平原",
              "broadcastText": "平原",
              "pinyinText": "píng yuán",
              "hintText": "汽车驶出山区，眼前是一望无际的（　　）。",
              "curriculumSource": "required_vocabulary",
              "builtinKey": "cn-g5-v1-u2-lesson-4-001"
            },
            {
              "answerText": "封锁",
              "broadcastText": "封锁",
              "pinyinText": "fēng suǒ",
              "hintText": "敌人（　　）了村口，乡亲们一时无法出入。",
              "curriculumSource": "required_vocabulary",
              "builtinKey": "cn-g5-v1-u2-lesson-4-002"
            },
            {
              "answerText": "粉碎",
              "broadcastText": "粉碎",
              "pinyinText": "fěn suì",
              "hintText": "乡亲们团结起来，（　　）了敌人搜捕的阴谋。",
              "curriculumSource": "required_vocabulary",
              "builtinKey": "cn-g5-v1-u2-lesson-4-003"
            },
            {
              "answerText": "简直",
              "broadcastText": "简直",
              "pinyinText": "jiǎn zhí",
              "hintText": "夕阳下的湖面金光闪闪，（　　）像铺满了金子。",
              "curriculumSource": "required_vocabulary",
              "builtinKey": "cn-g5-v1-u2-lesson-4-004"
            },
            {
              "answerText": "广阔",
              "broadcastText": "广阔",
              "pinyinText": "guǎng kuò",
              "hintText": "站在山顶，可以看见（　　）的田野一直延伸到远方。",
              "curriculumSource": "required_vocabulary",
              "builtinKey": "cn-g5-v1-u2-lesson-4-005"
            },
            {
              "answerText": "照常",
              "broadcastText": "照常",
              "pinyinText": "zhào cháng",
              "hintText": "虽然今天下着小雨，学校的课程仍然（　　）进行。",
              "curriculumSource": "required_vocabulary",
              "builtinKey": "cn-g5-v1-u2-lesson-4-006"
            },
            {
              "answerText": "游击",
              "broadcastText": "游击",
              "pinyinText": "yóu jī",
              "hintText": "战士们利用熟悉的山林地形，灵活开展（　　）作战。",
              "curriculumSource": "required_vocabulary",
              "builtinKey": "cn-g5-v1-u2-lesson-4-007"
            },
            {
              "answerText": "战争",
              "broadcastText": "战争",
              "pinyinText": "zhàn zhēng",